{
  "$schema": "https://design.ramoslabs.com/schema/kinds.v1.json",
  "contractVersion": "0.1.0",
  "kinds": [
    {
      "kind": "text",
      "type": ["text"],
      "inputmode": "text",
      "autocomplete": {
        "policy": "context",
        "default": "on"
      },
      "enter": "position",
      "autocapitalize": {
        "value": "sentences"
      },
      "autocorrect": "on",
      "spellcheck": true,
      "noMaxlength": false
    },
    {
      "kind": "name",
      "type": ["text"],
      "inputmode": "text",
      "autocomplete": {
        "policy": "token",
        "tokens": ["name"],
        "variants": ["given-name", "family-name"]
      },
      "enter": "position",
      "autocapitalize": {
        "value": "words"
      },
      "autocorrect": "off",
      "spellcheck": false,
      "noMaxlength": false
    },
    {
      "kind": "username",
      "type": ["text"],
      "inputmode": "text",
      "autocomplete": {
        "policy": "token",
        "tokens": ["username"]
      },
      "enter": "position",
      "autocapitalize": {
        "value": "none"
      },
      "autocorrect": "off",
      "spellcheck": false,
      "noMaxlength": false
    },
    {
      "kind": "email",
      "type": ["email"],
      "inputmode": "email",
      "autocomplete": {
        "policy": "token",
        "tokens": ["email"]
      },
      "enter": "position",
      "autocapitalize": {
        "value": "none"
      },
      "autocorrect": "off",
      "spellcheck": false,
      "noMaxlength": false
    },
    {
      "kind": "url",
      "type": ["url"],
      "inputmode": "url",
      "autocomplete": {
        "policy": "conditional",
        "tokens": ["url"],
        "when": "meaningful"
      },
      "enter": "go",
      "autocapitalize": {
        "value": "none"
      },
      "autocorrect": "off",
      "spellcheck": false,
      "noMaxlength": false
    },
    {
      "kind": "phone",
      "type": ["tel"],
      "inputmode": "tel",
      "autocomplete": {
        "policy": "token",
        "tokens": ["tel"],
        "variants": ["tel-*"]
      },
      "enter": "position",
      "autocapitalize": {
        "value": "none"
      },
      "autocorrect": "off",
      "spellcheck": false,
      "noMaxlength": true,
      "notes": "Unmasked editing, format on blur; no maxlength. Live masks require caret-mapping and paste tests."
    },
    {
      "kind": "otp",
      "type": ["text"],
      "inputmode": "numeric",
      "autocomplete": {
        "policy": "token",
        "tokens": ["one-time-code"]
      },
      "enter": "done",
      "autocapitalize": {
        "value": "none"
      },
      "autocorrect": "off",
      "spellcheck": false,
      "noMaxlength": true,
      "enterAlternatives": ["go"],
      "forbiddenTypes": ["number"],
      "notes": "Numeric. One control, paste-safe; ASCII-digit pattern optional; length validated after normalization; no maxlength. Enter is done (auto-submit off) or go (auto-submit on). A single text control: split-character inputs are not the default."
    },
    {
      "kind": "otp-alnum",
      "type": ["text"],
      "inputmode": "text",
      "autocomplete": {
        "policy": "token",
        "tokens": ["one-time-code"]
      },
      "enter": "done",
      "autocapitalize": {
        "value": "characters",
        "when": "canonical uppercase"
      },
      "autocorrect": "off",
      "spellcheck": false,
      "noMaxlength": true,
      "enterAlternatives": ["go"],
      "forbiddenTypes": ["number"],
      "notes": "Alphanumeric one-time code; autocapitalize characters only if the canonical form is uppercase. Single control; no maxlength."
    },
    {
      "kind": "amount",
      "type": ["text"],
      "inputmode": "decimal",
      "autocomplete": {
        "policy": "conditional",
        "tokens": ["transaction-amount"],
        "when": "only in that context"
      },
      "enter": "position",
      "autocapitalize": {
        "value": null
      },
      "autocorrect": "off",
      "spellcheck": false,
      "noMaxlength": true,
      "forbiddenTypes": ["number"],
      "notes": "Decimal. Intl display, owned deterministic parser; no spinbutton. Canonical value is separate from editing text; never parseFloat or binary money arithmetic."
    },
    {
      "kind": "amount-signed",
      "type": ["text"],
      "inputmode": "decimal",
      "autocomplete": {
        "policy": "conditional",
        "tokens": ["transaction-amount"],
        "when": "only in that context"
      },
      "enter": "position",
      "autocapitalize": {
        "value": null
      },
      "autocorrect": "off",
      "spellcheck": false,
      "noMaxlength": true,
      "variantOf": "amount",
      "forbiddenTypes": ["number"],
      "requiresSignControl": true,
      "notes": "amount with signed (credit notes, refunds). iOS decimal may omit the minus: render an explicit sign control (toggle or prefix part). The parser accepts a leading - or the minus sign U+2212 only when signed."
    },
    {
      "kind": "quantity",
      "type": ["number", "text"],
      "inputmode": "numeric",
      "autocomplete": {
        "policy": "context",
        "default": "off"
      },
      "enter": "position",
      "autocapitalize": {
        "value": null
      },
      "autocorrect": null,
      "spellcheck": null,
      "noMaxlength": false,
      "inputmodeWhen": "text variant",
      "notes": "type=number only where stepping helps; min, max, step."
    },
    {
      "kind": "postal",
      "type": ["text"],
      "inputmode": "numeric",
      "autocomplete": {
        "policy": "token",
        "tokens": ["postal-code"]
      },
      "enter": "position",
      "autocapitalize": {
        "value": null
      },
      "autocorrect": null,
      "spellcheck": null,
      "noMaxlength": true,
      "group": "postal-reference-account",
      "inputmodeWhen": "digits-only by contract",
      "forbiddenTypes": ["number"],
      "notes": "Preserve leading zeroes; never type=number; no maxlength."
    },
    {
      "kind": "reference",
      "type": ["text"],
      "inputmode": "numeric",
      "autocomplete": {
        "policy": "context"
      },
      "enter": "position",
      "autocapitalize": {
        "value": null
      },
      "autocorrect": null,
      "spellcheck": null,
      "noMaxlength": true,
      "group": "postal-reference-account",
      "inputmodeWhen": "digits-only by contract",
      "forbiddenTypes": ["number"],
      "notes": "Autocomplete is postal-code or a token chosen by domain. Preserve leading zeroes; never type=number; no maxlength."
    },
    {
      "kind": "account",
      "type": ["text"],
      "inputmode": "numeric",
      "autocomplete": {
        "policy": "context"
      },
      "enter": "position",
      "autocapitalize": {
        "value": null
      },
      "autocorrect": null,
      "spellcheck": null,
      "noMaxlength": true,
      "group": "postal-reference-account",
      "inputmodeWhen": "digits-only by contract",
      "forbiddenTypes": ["number"],
      "notes": "Autocomplete is postal-code or a token chosen by domain. Preserve leading zeroes; never type=number; no maxlength."
    },
    {
      "kind": "tax-id",
      "type": ["text"],
      "inputmode": "numeric",
      "autocomplete": {
        "policy": "omitted"
      },
      "enter": "position",
      "autocapitalize": {
        "value": null
      },
      "autocorrect": null,
      "spellcheck": null,
      "noMaxlength": true,
      "inputmodeWhen": "digits-only",
      "forbiddenTypes": ["number"],
      "notes": "Attribute omitted: no standard token, and off is not a generic suppressor. Normalize, then validate the check digit."
    },
    {
      "kind": "search",
      "type": ["search"],
      "inputmode": "search",
      "autocomplete": {
        "policy": "off",
        "when": "usually"
      },
      "enter": "search",
      "autocapitalize": {
        "value": null,
        "when": "by domain"
      },
      "autocorrect": null,
      "spellcheck": null,
      "noMaxlength": false
    },
    {
      "kind": "password",
      "type": ["password"],
      "inputmode": "text",
      "autocomplete": {
        "policy": "token",
        "tokens": ["current-password"]
      },
      "enter": "position",
      "autocapitalize": {
        "value": "none"
      },
      "autocorrect": "off",
      "spellcheck": false,
      "noMaxlength": false,
      "notes": "Current password."
    },
    {
      "kind": "password-new",
      "type": ["password"],
      "inputmode": "text",
      "autocomplete": {
        "policy": "token",
        "tokens": ["new-password"]
      },
      "enter": "position",
      "autocapitalize": {
        "value": "none"
      },
      "autocorrect": "off",
      "spellcheck": false,
      "noMaxlength": false,
      "notes": "Distinct section tokens if needed."
    },
    {
      "kind": "date",
      "type": ["date"],
      "inputmode": null,
      "autocomplete": {
        "policy": "conditional",
        "tokens": ["bday"],
        "when": "birth date only"
      },
      "enter": "position",
      "autocapitalize": {
        "value": null
      },
      "autocorrect": null,
      "spellcheck": null,
      "noMaxlength": false,
      "notes": "Native picker; value yyyy-mm-dd."
    },
    {
      "kind": "time",
      "type": ["time"],
      "inputmode": null,
      "autocomplete": {
        "policy": "context",
        "default": "off"
      },
      "enter": "position",
      "autocapitalize": {
        "value": null
      },
      "autocorrect": null,
      "spellcheck": null,
      "noMaxlength": false,
      "notes": "step when needed."
    },
    {
      "kind": "choice",
      "type": ["select"],
      "inputmode": null,
      "autocomplete": {
        "policy": "context"
      },
      "enter": "position",
      "autocapitalize": {
        "value": null
      },
      "autocorrect": null,
      "spellcheck": null,